{
 "contract_version": "0.1.0",
 "id": "demo-coffee-001-differential",
 "data_mode": "demo",
 "observed_at": "2026-10-03T08:00:00Z",
 "crop": "coffee",
 "locale": "en",
 "location": {
  "latitude": -1.95,
  "longitude": 30.06
 },
 "signals": [
  {
   "label": "orange_powder_leaf_underside",
   "confidence": 0.9,
   "affected_leaf_area_pct": 12
  },
  {
   "label": "cercospora_leaf_spot_marks",
   "confidence": 0.6
  }
 ],
 "provenance": {
  "adapter": "mock-vlm",
  "source": "synthetic fixture; no model inference"
 }
}
